{"id":"citroen-c4","names":{"en":"ë-C4","zh":"ë-C4"},"slug":"citroen-c4","brand":"citroen","type":"SEDAN","fuelType":"electric","year":2025,"images":["/images/vehicles/citroen/citroen-c4-01.webp","/images/vehicles/citroen/citroen-c4-02.webp","/images/vehicles/citroen/citroen-c4-03.webp","/images/vehicles/citroen/citroen-c4-04.webp"],"specs":{"seats":5,"drive":"AWD"},"featured":false,"inStock":true,"isNew":true,"order":554,"description":{"en":"ë-C4 is available for export at PowerNowAuto.","zh":"ë-C4现可在 PowerNowAuto 进行出口咨询。"}}
