{"id":"chery-fengyun-a8","names":{"en":"风云 A8","zh":"风云 A8"},"slug":"chery-fengyun-a8","brand":"chery_fengyun","type":"SEDAN","fuelType":"electric","year":2025,"images":["/images/vehicles/chery_fengyun/chery-fengyun-a8-01.webp","/images/vehicles/chery_fengyun/chery-fengyun-a8-02.webp","/images/vehicles/chery_fengyun/chery-fengyun-a8-03.webp","/images/vehicles/chery_fengyun/chery-fengyun-a8-04.webp"],"specs":{"seats":5,"drive":"AWD"},"featured":false,"inStock":true,"isNew":true,"order":405,"description":{"en":"风云 A8 is available for export at PowerNowAuto.","zh":"风云 A8现可在 PowerNowAuto 进行出口咨询。"}}
