{"id":"peugeot-e-5008","names":{"en":"e-5008","zh":"e-5008"},"slug":"peugeot-e-5008","brand":"peugeot","type":"SEDAN","fuelType":"electric","year":2025,"images":["/images/vehicles/peugeot/peugeot-e-5008-01.svg","/images/vehicles/peugeot/peugeot-e-5008-02.svg","/images/vehicles/peugeot/peugeot-e-5008-03.svg","/images/vehicles/peugeot/peugeot-e-5008-04.svg"],"specs":{"seats":5,"drive":"AWD"},"featured":false,"inStock":true,"isNew":true,"order":549,"description":{"en":"e-5008 is available for export at PowerNowAuto.","zh":"e-5008现可在 PowerNowAuto 进行出口咨询。"}}