{"id":"kia-ev6","names":{"en":"EV6","zh":"EV6"},"slug":"kia-ev6","brand":"kia","type":"SUV","fuelType":"electric","year":2025,"images":["/images/vehicles/kia/kia-ev6-01.webp","/images/vehicles/kia/kia-ev6-02.webp","/images/vehicles/kia/kia-ev6-03.webp","/images/vehicles/kia/kia-ev6-04.webp"],"specs":{"seats":5,"drive":"AWD"},"featured":false,"inStock":true,"isNew":true,"order":514,"description":{"en":"EV6 is available for export at PowerNowAuto.","zh":"EV6现可在 PowerNowAuto 进行出口咨询。"}}
