{"id":"geely-galaxy-e5","names":{"en":"银河 E5","zh":"银河 E5"},"slug":"geely-galaxy-e5","brand":"geely_galaxy","type":"SEDAN","fuelType":"electric","year":2025,"images":["/images/vehicles/geely_galaxy/geely-galaxy-e5-01.svg","/images/vehicles/geely_galaxy/geely-galaxy-e5-02.svg","/images/vehicles/geely_galaxy/geely-galaxy-e5-03.svg","/images/vehicles/geely_galaxy/geely-galaxy-e5-04.svg"],"specs":{"seats":5,"drive":"AWD"},"featured":false,"inStock":true,"isNew":true,"order":278,"description":{"en":"银河 E5 is available for export at PowerNowAuto.","zh":"银河 E5现可在 PowerNowAuto 进行出口咨询。"}}