{"id":"xiaomi-su7-","names":{"en":"小米 SU7 标准版","zh":"小米 SU7 标准版"},"slug":"xiaomi-su7-","brand":"xiaomi","type":"OFFROAD","fuelType":"electric","year":2026,"images":["/images/vehicles/xiaomi/xiaomi-su7--01.webp","/images/vehicles/xiaomi/xiaomi-su7--02.webp","/images/vehicles/xiaomi/xiaomi-su7--03.webp","/images/vehicles/xiaomi/xiaomi-su7--04.webp"],"specs":{"seats":5,"drive":"AWD"},"featured":false,"inStock":true,"isNew":true,"order":256,"description":{"en":"小米 SU7 标准版 is available for export at PowerNowAuto.","zh":"小米 SU7 标准版现可在 PowerNowAuto 进行出口咨询。"}}
