{"id":"cadillac-ct5-vblackwingev","names":{"en":"CT5-V Blackwing EV","zh":"CT5-V Blackwing EV"},"slug":"cadillac-ct5-vblackwingev","brand":"cadillac","type":"SEDAN","fuelType":"electric","year":2025,"images":["/images/vehicles/cadillac/cadillac-ct5-vblackwingev-01.svg","/images/vehicles/cadillac/cadillac-ct5-vblackwingev-02.svg","/images/vehicles/cadillac/cadillac-ct5-vblackwingev-03.svg","/images/vehicles/cadillac/cadillac-ct5-vblackwingev-04.svg"],"specs":{"seats":5,"drive":"AWD"},"featured":false,"inStock":true,"isNew":true,"order":497,"description":{"en":"CT5-V Blackwing EV is available for export at PowerNowAuto.","zh":"CT5-V Blackwing EV现可在 PowerNowAuto 进行出口咨询。"}}