{"id":"polestar-polestar3-","names":{"en":"Polestar 3 高性能版","zh":"Polestar 3 高性能版"},"slug":"polestar-polestar3-","brand":"polestar","type":"SEDAN","fuelType":"electric","year":2025,"images":["/images/vehicles/polestar/polestar-polestar3--01.svg","/images/vehicles/polestar/polestar-polestar3--02.svg","/images/vehicles/polestar/polestar-polestar3--03.svg","/images/vehicles/polestar/polestar-polestar3--04.svg"],"specs":{"seats":5,"drive":"AWD"},"featured":false,"inStock":true,"isNew":true,"order":288,"description":{"en":"Polestar 3 高性能版 is available for export at PowerNowAuto.","zh":"Polestar 3 高性能版现可在 PowerNowAuto 进行出口咨询。"}}