{"id":"geely-galaxy-ex2","names":{"en":"银河星愿 EX2","zh":"银河星愿 EX2"},"slug":"geely-galaxy-ex2","brand":"geely_galaxy","type":"SEDAN","fuelType":"electric","year":2025,"images":["/images/vehicles/geely_galaxy/geely-galaxy-ex2-01.svg","/images/vehicles/geely_galaxy/geely-galaxy-ex2-02.svg","/images/vehicles/geely_galaxy/geely-galaxy-ex2-03.svg","/images/vehicles/geely_galaxy/geely-galaxy-ex2-04.svg"],"specs":{"seats":5,"drive":"AWD"},"featured":false,"inStock":true,"isNew":true,"order":277,"description":{"en":"银河星愿 EX2 is available for export at PowerNowAuto.","zh":"银河星愿 EX2现可在 PowerNowAuto 进行出口咨询。"}}