{"id":"ford-ev-f-150lightning","names":{"en":"F-150 Lightning","zh":"F-150 Lightning"},"slug":"ford-ev-f-150lightning","brand":"ford_ev","type":"SUV","fuelType":"electric","year":2025,"images":["/images/vehicles/ford_ev/ford-ev-f-150lightning-01.webp","/images/vehicles/ford_ev/ford-ev-f-150lightning-02.webp","/images/vehicles/ford_ev/ford-ev-f-150lightning-03.webp","/images/vehicles/ford_ev/ford-ev-f-150lightning-04.webp"],"specs":{"seats":5,"drive":"AWD"},"featured":false,"inStock":true,"isNew":true,"order":499,"description":{"en":"F-150 Lightning is available for export at PowerNowAuto.","zh":"F-150 Lightning现可在 PowerNowAuto 进行出口咨询。"}}
