{"id":"porsche-taycanturbos","names":{"en":"Taycan Turbo S","zh":"Taycan Turbo S"},"slug":"porsche-taycanturbos","brand":"porsche","type":"SPORTS","fuelType":"electric","year":2025,"images":["/images/vehicles/porsche/porsche-taycanturbos-01.webp","/images/vehicles/porsche/porsche-taycanturbos-02.webp","/images/vehicles/porsche/porsche-taycanturbos-03.webp","/images/vehicles/porsche/porsche-taycanturbos-04.webp"],"specs":{"seats":5,"drive":"AWD"},"featured":false,"inStock":true,"isNew":true,"order":469,"description":{"en":"Taycan Turbo S is available for export at PowerNowAuto.","zh":"Taycan Turbo S现可在 PowerNowAuto 进行出口咨询。"}}
