{"id":"hyundai-nexo","names":{"en":"Nexo","zh":"Nexo"},"slug":"hyundai-nexo","brand":"hyundai","type":"SEDAN","fuelType":"electric","year":2025,"images":["/images/vehicles/hyundai/hyundai-nexo-01.svg","/images/vehicles/hyundai/hyundai-nexo-02.svg","/images/vehicles/hyundai/hyundai-nexo-03.svg","/images/vehicles/hyundai/hyundai-nexo-04.svg"],"specs":{"seats":5,"drive":"AWD"},"featured":false,"inStock":true,"isNew":true,"order":511,"description":{"en":"Nexo is available for export at PowerNowAuto.","zh":"Nexo现可在 PowerNowAuto 进行出口咨询。"}}