{"id":"infiniti-ev-jxev","names":{"en":"JX EV","zh":"JX EV"},"slug":"infiniti-ev-jxev","brand":"infiniti_ev","type":"SEDAN","fuelType":"electric","year":2025,"images":["/images/vehicles/infiniti_ev/infiniti-ev-jxev-01.svg","/images/vehicles/infiniti_ev/infiniti-ev-jxev-02.svg","/images/vehicles/infiniti_ev/infiniti-ev-jxev-03.svg","/images/vehicles/infiniti_ev/infiniti-ev-jxev-04.svg"],"specs":{"seats":5,"drive":"AWD"},"featured":false,"inStock":true,"isNew":true,"order":599,"description":{"en":"JX EV is available for export at PowerNowAuto.","zh":"JX EV现可在 PowerNowAuto 进行出口咨询。"}}