{"id":"nissan-ev-maximaev","names":{"en":"Maxima EV","zh":"Maxima EV"},"slug":"nissan-ev-maximaev","brand":"nissan_ev","type":"SEDAN","fuelType":"electric","year":2025,"images":["/images/vehicles/nissan_ev/nissan-ev-maximaev-01.svg","/images/vehicles/nissan_ev/nissan-ev-maximaev-02.svg","/images/vehicles/nissan_ev/nissan-ev-maximaev-03.svg","/images/vehicles/nissan_ev/nissan-ev-maximaev-04.svg"],"specs":{"seats":5,"drive":"AWD"},"featured":false,"inStock":true,"isNew":true,"order":592,"description":{"en":"Maxima EV is available for export at PowerNowAuto.","zh":"Maxima EV现可在 PowerNowAuto 进行出口咨询。"}}