{"id":"polestar-polestar2-","names":{"en":"Polestar 2 长续航版","zh":"Polestar 2 长续航版"},"slug":"polestar-polestar2-","brand":"polestar","type":"SEDAN","fuelType":"electric","year":2025,"images":["/images/vehicles/polestar/polestar-polestar2--01.svg","/images/vehicles/polestar/polestar-polestar2--02.svg","/images/vehicles/polestar/polestar-polestar2--03.svg","/images/vehicles/polestar/polestar-polestar2--04.svg"],"specs":{"seats":5,"drive":"AWD"},"featured":false,"inStock":true,"isNew":true,"order":287,"description":{"en":"Polestar 2 长续航版 is available for export at PowerNowAuto.","zh":"Polestar 2 长续航版现可在 PowerNowAuto 进行出口咨询。"}}