{"id":"nissan-ev-leaf","names":{"en":"Leaf","zh":"Leaf"},"slug":"nissan-ev-leaf","brand":"nissan_ev","type":"SEDAN","fuelType":"electric","year":2025,"images":["/images/vehicles/nissan_ev/nissan-ev-leaf-01.svg","/images/vehicles/nissan_ev/nissan-ev-leaf-02.svg","/images/vehicles/nissan_ev/nissan-ev-leaf-03.svg","/images/vehicles/nissan_ev/nissan-ev-leaf-04.svg"],"specs":{"seats":5,"drive":"AWD"},"featured":false,"inStock":true,"isNew":true,"order":587,"description":{"en":"Leaf is available for export at PowerNowAuto.","zh":"Leaf现可在 PowerNowAuto 进行出口咨询。"}}