{"id":"hyundai-ioniq5","names":{"en":"IONIQ 5","zh":"IONIQ 5"},"slug":"hyundai-ioniq5","brand":"hyundai","type":"SUV","fuelType":"electric","year":2025,"images":["/images/vehicles/hyundai/hyundai-ioniq5-01.svg","/images/vehicles/hyundai/hyundai-ioniq5-02.svg","/images/vehicles/hyundai/hyundai-ioniq5-03.svg","/images/vehicles/hyundai/hyundai-ioniq5-04.svg"],"specs":{"seats":5,"drive":"AWD"},"featured":false,"inStock":true,"isNew":true,"order":506,"description":{"en":"IONIQ 5 is available for export at PowerNowAuto.","zh":"IONIQ 5现可在 PowerNowAuto 进行出口咨询。"}}