{"id":"hechuang-z03-","names":{"en":"合创 Z03 潮酷版","zh":"合创 Z03 潮酷版"},"slug":"hechuang-z03-","brand":"hechuang","type":"SEDAN","fuelType":"electric","year":2025,"images":["/images/vehicles/hechuang/hechuang-z03--01.webp","/images/vehicles/hechuang/hechuang-z03--02.webp","/images/vehicles/hechuang/hechuang-z03--03.webp","/images/vehicles/hechuang/hechuang-z03--04.webp"],"specs":{"seats":5,"drive":"AWD"},"featured":false,"inStock":true,"isNew":true,"order":334,"description":{"en":"合创 Z03 潮酷版 is available for export at PowerNowAuto.","zh":"合创 Z03 潮酷版现可在 PowerNowAuto 进行出口咨询。"}}
