{"id":"benz-eq-eqa","names":{"en":"EQA","zh":"EQA"},"slug":"benz-eq-eqa","brand":"benz_eq","type":"SEDAN","fuelType":"electric","year":2025,"images":["/images/vehicles/benz_eq/benz-eq-eqa-01.svg","/images/vehicles/benz_eq/benz-eq-eqa-02.svg","/images/vehicles/benz_eq/benz-eq-eqa-03.svg","/images/vehicles/benz_eq/benz-eq-eqa-04.svg"],"specs":{"seats":5,"drive":"AWD"},"featured":false,"inStock":true,"isNew":true,"order":444,"description":{"en":"EQA is available for export at PowerNowAuto.","zh":"EQA现可在 PowerNowAuto 进行出口咨询。"}}