{"id":"renault-sc-nice-tech","names":{"en":"Scénic E-Tech","zh":"Scénic E-Tech"},"slug":"renault-sc-nice-tech","brand":"renault","type":"SEDAN","fuelType":"electric","year":2025,"images":["/images/vehicles/renault/renault-sc-nice-tech-01.svg","/images/vehicles/renault/renault-sc-nice-tech-02.svg","/images/vehicles/renault/renault-sc-nice-tech-03.svg","/images/vehicles/renault/renault-sc-nice-tech-04.svg"],"specs":{"seats":5,"drive":"AWD"},"featured":false,"inStock":true,"isNew":true,"order":540,"description":{"en":"Scénic E-Tech is available for export at PowerNowAuto.","zh":"Scénic E-Tech现可在 PowerNowAuto 进行出口咨询。"}}