{"id":"benz-eq-eqssuv","names":{"en":"EQS SUV","zh":"EQS SUV"},"slug":"benz-eq-eqssuv","brand":"benz_eq","type":"SUV","fuelType":"electric","year":2025,"images":["/images/vehicles/benz_eq/benz-eq-eqssuv-01.svg","/images/vehicles/benz_eq/benz-eq-eqssuv-02.svg","/images/vehicles/benz_eq/benz-eq-eqssuv-03.svg","/images/vehicles/benz_eq/benz-eq-eqssuv-04.svg"],"specs":{"seats":5,"drive":"AWD"},"featured":false,"inStock":true,"isNew":true,"order":448,"description":{"en":"EQS SUV is available for export at PowerNowAuto.","zh":"EQS SUV现可在 PowerNowAuto 进行出口咨询。"}}