{"id":"xiaomi-su7max","names":{"en":"小米 SU7 Max","zh":"小米 SU7 Max"},"slug":"xiaomi-su7max","brand":"xiaomi","type":"OFFROAD","fuelType":"electric","year":2026,"images":["/images/vehicles/xiaomi/xiaomi-su7max-01.webp","/images/vehicles/xiaomi/xiaomi-su7max-02.webp","/images/vehicles/xiaomi/xiaomi-su7max-03.webp","/images/vehicles/xiaomi/xiaomi-su7max-04.webp"],"specs":{"seats":5,"drive":"AWD"},"featured":false,"inStock":true,"isNew":true,"order":252,"description":{"en":"小米 SU7 Max is available for export at PowerNowAuto.","zh":"小米 SU7 Max现可在 PowerNowAuto 进行出口咨询。"}}
