{"id":"aito-m7","names":{"en":"问界 M7","zh":"问界 M7"},"slug":"aito-m7","brand":"aito","type":"SUV","fuelType":"electric","year":2025,"images":["/images/vehicles/aito/aito-m7-01.webp","/images/vehicles/aito/aito-m7-02.webp","/images/vehicles/aito/aito-m7-03.webp","/images/vehicles/aito/aito-m7-04.webp"],"specs":{"seats":5,"drive":"AWD"},"featured":false,"inStock":true,"isNew":true,"order":244,"description":{"en":"问界 M7 is available for export at PowerNowAuto.","zh":"问界 M7现可在 PowerNowAuto 进行出口咨询。"}}
