{"id":"subaru-outbackhybrid","names":{"en":"Outback Hybrid","zh":"Outback Hybrid"},"slug":"subaru-outbackhybrid","brand":"subaru","type":"SUV","fuelType":"electric","year":2025,"images":["/images/vehicles/subaru/subaru-outbackhybrid-01.svg","/images/vehicles/subaru/subaru-outbackhybrid-02.svg","/images/vehicles/subaru/subaru-outbackhybrid-03.svg","/images/vehicles/subaru/subaru-outbackhybrid-04.svg"],"specs":{"seats":5,"drive":"AWD"},"featured":false,"inStock":true,"isNew":true,"order":565,"description":{"en":"Outback Hybrid is available for export at PowerNowAuto.","zh":"Outback Hybrid现可在 PowerNowAuto 进行出口咨询。"}}